{
  "$schema_version": "1.0",
  "created_at": "2026-08-06T00:00:00Z",
  "user": {
    "name": "Samy"
  },
  "program": {
    "name": "Summer Build",
    "emoji": "💪",
    "primary_goal": "hypertrophy",
    "days_per_week": 6,
    "session_minutes": "60-90",
    "split": "upper_lower",
    "deload": true
  },
  "dataset": {
    "name": "exercises-dataset",
    "repo": "https://github.com/smyrdev/exercises-dataset",
    "ref": "main",
    "commit": null
  },
  "rules_applied": {
    "exclude": {
      "exercises": [],
      "equipment": [],
      "movement_groups": [],
      "muscles": []
    },
    "focus": {
      "muscles": [],
      "must_include": []
    },
    "order": [
      "must_include_first",
      "trailer_groups_last",
      "compound_before_isolation",
      "focus_muscles_first",
      "large_groups_before_small"
    ]
  },
  "targets": {
    "chest": {
      "allocated": 14,
      "planned": 15.8
    },
    "back": {
      "allocated": 17,
      "planned": 18.0
    },
    "shoulders": {
      "allocated": 16,
      "planned": 16.5
    },
    "biceps": {
      "allocated": 17,
      "planned": 17.2
    },
    "triceps": {
      "allocated": 16,
      "planned": 18.0
    },
    "quads": {
      "allocated": 16,
      "planned": 18.0
    },
    "hamstrings": {
      "allocated": 13,
      "planned": 15.0
    },
    "glutes": {
      "allocated": 13,
      "planned": 18.0
    },
    "calves": {
      "allocated": 12,
      "planned": 14.2
    },
    "core": {
      "allocated": 10,
      "planned": 12.0
    }
  },
  "sessions": [
    {
      "day": 1,
      "focus": "upper",
      "exercises": [
        {
          "id": "9012",
          "name": "barbell bent over row",
          "equipment": "barbell",
          "movement_group": "Pulls",
          "primary": "back",
          "sets": 3,
          "reps": "8-12",
          "volume": {
            "back": 1.0,
            "biceps": 0.5,
            "core": 0.5,
            "shoulders": 0.5
          }
        },
        {
          "id": "9002",
          "name": "push-up",
          "equipment": "body weight",
          "movement_group": "Chest",
          "primary": "chest",
          "sets": 3,
          "reps": "8-12",
          "volume": {
            "chest": 1.0,
            "core": 0.5,
            "shoulders": 1.0,
            "triceps": 1.0
          }
        },
        {
          "id": "9001",
          "name": "barbell bench press",
          "equipment": "barbell",
          "movement_group": "Chest",
          "primary": "chest",
          "sets": 3,
          "reps": "8-12",
          "volume": {
            "chest": 1.0,
            "shoulders": 1.0,
            "triceps": 1.0
          }
        },
        {
          "id": "9010",
          "name": "pull-up",
          "equipment": "body weight",
          "movement_group": "Pulls",
          "primary": "back",
          "sets": 3,
          "reps": "10-15",
          "volume": {
            "back": 1.0,
            "biceps": 0.5
          }
        },
        {
          "id": "9030",
          "name": "barbell curl",
          "equipment": "barbell",
          "movement_group": "Biceps curls",
          "primary": "biceps",
          "sets": 3,
          "reps": "10-15",
          "volume": {
            "biceps": 1.0
          }
        },
        {
          "id": "9031",
          "name": "dumbbell hammer curl",
          "equipment": "dumbbell",
          "movement_group": "Biceps curls",
          "primary": "biceps",
          "sets": 3,
          "reps": "10-15",
          "volume": {
            "biceps": 1.0
          }
        }
      ]
    },
    {
      "day": 2,
      "focus": "lower",
      "exercises": [
        {
          "id": "9050",
          "name": "barbell squat",
          "equipment": "barbell",
          "movement_group": "Squat movements",
          "primary": "quads",
          "sets": 3,
          "reps": "8-12",
          "volume": {
            "calves": 0.5,
            "core": 0.5,
            "glutes": 1.0,
            "hamstrings": 0.5,
            "quads": 1.0
          }
        },
        {
          "id": "9051",
          "name": "dumbbell lunge",
          "equipment": "dumbbell",
          "movement_group": "Squat movements",
          "primary": "quads",
          "sets": 3,
          "reps": "8-12",
          "volume": {
            "calves": 0.5,
            "glutes": 1.0,
            "quads": 1.0
          }
        },
        {
          "id": "9052",
          "name": "leg extension",
          "equipment": "leverage machine",
          "movement_group": "Leg extensions",
          "primary": "quads",
          "sets": 3,
          "reps": "10-15",
          "volume": {
            "quads": 1.0
          }
        },
        {
          "id": "9080",
          "name": "standing calf raise",
          "equipment": "body weight",
          "movement_group": "Calf raises/jumps",
          "primary": "calves",
          "sets": 3,
          "reps": "10-15",
          "volume": {
            "calves": 1.0
          }
        },
        {
          "id": "9091",
          "name": "plank",
          "equipment": "body weight",
          "movement_group": "Core",
          "primary": "core",
          "sets": 3,
          "reps": "10-15",
          "volume": {
            "core": 1.0
          }
        }
      ]
    },
    {
      "day": 3,
      "focus": "upper",
      "exercises": [
        {
          "id": "9002",
          "name": "push-up",
          "equipment": "body weight",
          "movement_group": "Chest",
          "primary": "chest",
          "sets": 3,
          "reps": "8-12",
          "volume": {
            "chest": 1.0,
            "core": 0.5,
            "shoulders": 1.0,
            "triceps": 1.0
          }
        },
        {
          "id": "9001",
          "name": "barbell bench press",
          "equipment": "barbell",
          "movement_group": "Chest",
          "primary": "chest",
          "sets": 3,
          "reps": "8-12",
          "volume": {
            "chest": 1.0,
            "shoulders": 1.0,
            "triceps": 1.0
          }
        },
        {
          "id": "9014",
          "name": "band pull-up",
          "equipment": "band",
          "movement_group": "Pulls",
          "primary": "back",
          "sets": 3,
          "reps": "10-15",
          "volume": {
            "back": 1.0,
            "biceps": 0.5
          }
        },
        {
          "id": "9013",
          "name": "one arm dumbbell row",
          "equipment": "dumbbell",
          "movement_group": "Pulls",
          "primary": "back",
          "sets": 3,
          "reps": "10-15",
          "volume": {
            "back": 1.0,
            "biceps": 0.5
          }
        },
        {
          "id": "9030",
          "name": "barbell curl",
          "equipment": "barbell",
          "movement_group": "Biceps curls",
          "primary": "biceps",
          "sets": 3,
          "reps": "10-15",
          "volume": {
            "biceps": 1.0
          }
        }
      ]
    },
    {
      "day": 4,
      "focus": "lower",
      "exercises": [
        {
          "id": "9050",
          "name": "barbell squat",
          "equipment": "barbell",
          "movement_group": "Squat movements",
          "primary": "quads",
          "sets": 3,
          "reps": "8-12",
          "volume": {
            "calves": 0.5,
            "core": 0.5,
            "glutes": 1.0,
            "hamstrings": 0.5,
            "quads": 1.0
          }
        },
        {
          "id": "9053",
          "name": "sled leg press",
          "equipment": "sled machine",
          "movement_group": "Squat movements",
          "primary": "quads",
          "sets": 3,
          "reps": "8-12",
          "volume": {
            "glutes": 1.0,
            "hamstrings": 0.5,
            "quads": 1.0
          }
        },
        {
          "id": "9061",
          "name": "lying leg curl",
          "equipment": "leverage machine",
          "movement_group": "Leg curls",
          "primary": "hamstrings",
          "sets": 3,
          "reps": "10-15",
          "volume": {
            "calves": 0.5,
            "hamstrings": 1.0
          }
        },
        {
          "id": "9062",
          "name": "nordic hamstring curl",
          "equipment": "body weight",
          "movement_group": "Leg curls",
          "primary": "hamstrings",
          "sets": 3,
          "reps": "10-15",
          "volume": {
            "calves": 0.5,
            "hamstrings": 1.0
          }
        },
        {
          "id": "9081",
          "name": "weighted seated calf raise",
          "equipment": "weighted",
          "movement_group": "Calf raises/jumps",
          "primary": "calves",
          "sets": 3,
          "reps": "10-15",
          "volume": {
            "calves": 1.0
          }
        }
      ]
    },
    {
      "day": 5,
      "focus": "upper",
      "exercises": [
        {
          "id": "9002",
          "name": "push-up",
          "equipment": "body weight",
          "movement_group": "Chest",
          "primary": "chest",
          "sets": 3,
          "reps": "8-12",
          "volume": {
            "chest": 1.0,
            "core": 0.5,
            "shoulders": 1.0,
            "triceps": 1.0
          }
        },
        {
          "id": "9040",
          "name": "bench dip",
          "equipment": "body weight",
          "movement_group": "Triceps extensions",
          "primary": "triceps",
          "sets": 3,
          "reps": "8-12",
          "volume": {
            "chest": 0.5,
            "shoulders": 0.5,
            "triceps": 1.0
          }
        },
        {
          "id": "9011",
          "name": "assisted pull-up",
          "equipment": "leverage machine",
          "movement_group": "Pulls",
          "primary": "back",
          "sets": 3,
          "reps": "10-15",